{
  "$schema": "https://json-schema.org/draft/2020-12/schema",
  "$id": "https://hulensdata.dk/schemas/editorial-inbox-1.0.0.json",
  "title": "Hulens Data editorial inbox",
  "type": "object",
  "additionalProperties": false,
  "required": ["schema_version", "inbox_id", "created_at", "created_by", "baseline", "status", "operations"],
  "properties": {
    "schema_version": { "const": "1.0.0" },
    "inbox_id": { "$ref": "#/$defs/uuid" },
    "created_at": { "type": "string", "format": "date-time" },
    "created_by": { "$ref": "#/$defs/actor" },
    "baseline": {
      "type": "object",
      "additionalProperties": false,
      "required": ["snapshot_sha256", "snapshot_date", "git_sha"],
      "properties": {
        "snapshot_sha256": { "$ref": "#/$defs/sha256" },
        "snapshot_date": { "type": "string", "format": "date" },
        "git_sha": { "type": "string", "pattern": "^[0-9a-f]{40}$" }
      }
    },
    "status": { "enum": ["new", "triaged", "in_review", "accepted", "rejected", "blocked"] },
    "review": {
      "oneOf": [
        { "type": "null" },
        {
          "type": "object",
          "additionalProperties": false,
          "required": ["reviewer", "reviewed_at", "decision", "reason"],
          "properties": {
            "reviewer": { "$ref": "#/$defs/actor" },
            "reviewed_at": { "type": "string", "format": "date-time" },
            "decision": { "enum": ["accepted", "rejected", "blocked"] },
            "reason": { "type": "string", "minLength": 1, "maxLength": 2000 }
          }
        }
      ]
    },
    "operations": {
      "type": "array",
      "minItems": 1,
      "maxItems": 200,
      "items": { "$ref": "#/$defs/operation" }
    }
  },
  "$defs": {
    "uuid": { "type": "string", "format": "uuid" },
    "sha256": { "type": "string", "pattern": "^[0-9a-f]{64}$" },
    "actor": {
      "type": "object",
      "additionalProperties": false,
      "required": ["kind", "id"],
      "properties": {
        "kind": { "enum": ["human", "agent", "system"] },
        "id": { "enum": ["alexander", "codex", "fable", "system"] }
      }
    },
    "target": {
      "type": "object",
      "additionalProperties": false,
      "required": ["entity_type", "record_id"],
      "properties": {
        "entity_type": { "enum": ["company", "deal", "investor", "season", "company_event", "source", "deal_investor", "panel_membership"] },
        "record_id": { "type": ["integer", "null"], "minimum": 1 },
        "local_ref": { "type": ["string", "null"], "pattern": "^new:[a-z0-9][a-z0-9-]{0,60}$" },
        "secondary_id": { "type": ["integer", "null"], "minimum": 1 },
        "secondary_local_ref": { "type": ["string", "null"], "pattern": "^new:[a-z0-9][a-z0-9-]{0,60}$" },
        "slug": { "type": ["string", "null"], "pattern": "^[a-z0-9]+(?:-[a-z0-9]+)*$" }
      }
    },
    "source_proposal": {
      "type": "object",
      "additionalProperties": false,
      "required": ["source_name", "source_url", "source_date", "confidence", "supports", "note"],
      "properties": {
        "source_name": { "type": "string", "minLength": 1, "maxLength": 300 },
        "source_url": { "type": ["string", "null"], "format": "http-url" },
        "source_date": { "type": ["string", "null"], "format": "date" },
        "confidence": { "enum": ["confirmed", "likely", "uncertain"] },
        "supports": { "type": "array", "uniqueItems": true, "items": { "type": "string", "pattern": "^[a-z][a-z0-9_]*$" } },
        "note": { "type": ["string", "null"], "maxLength": 2000 }
      }
    },
    "change": {
      "type": "object",
      "additionalProperties": false,
      "required": ["field", "action", "expected_before", "value"],
      "properties": {
        "field": { "type": "string", "pattern": "^[a-z][a-z0-9_]*$" },
        "action": { "enum": ["set", "clear"] },
        "expected_before": {},
        "value": {}
      }
    },
    "operation": {
      "type": "object",
      "additionalProperties": false,
      "required": ["operation_id", "kind", "target", "reason", "changes", "sources", "depends_on"],
      "properties": {
        "operation_id": { "$ref": "#/$defs/uuid" },
        "kind": { "enum": ["insert", "update", "link", "unlink"] },
        "target": { "$ref": "#/$defs/target" },
        "redirect_from": { "type": ["string", "null"], "pattern": "^[a-z0-9]+(?:-[a-z0-9]+)*$" },
        "reason": { "type": "string", "minLength": 1, "maxLength": 2000 },
        "changes": { "type": "array", "minItems": 1, "maxItems": 50, "items": { "$ref": "#/$defs/change" } },
        "sources": { "type": "array", "maxItems": 50, "items": { "$ref": "#/$defs/source_proposal" } },
        "depends_on": { "type": "array", "uniqueItems": true, "items": { "$ref": "#/$defs/uuid" } }
      }
    }
  }
}
